{
  "title": "Выгрузка отчёта",
  "kind": "page",
  "parent": "index",
  "body": [
    "Пользователь выгружает отчёт кнопкой «Скачать».",
    "Файл CSV использует разделитель `;` и кодировку UTF-8 с BOM. ^csv-format",
    "Имя файла: `report-ГГГГ-ММ-ДД.csv`, где дата берётся из начала периода отчёта. ^file-name"
  ]
}
